{
  "schemaVersion": 1,
  "id": "cybersec",
  "title": "Cybersecurity",
  "description": "Security review, secrets/PII awareness, and pre-merge hardening. Includes git-secrets-safety as a pack double-check (also L0 always-on).",
  "version": "0.2.0",
  "members": [
    {
      "kind": "skill",
      "id": "security-review",
      "source": "registry/skills/core/security-review"
    },
    {
      "kind": "agent",
      "id": "security-reviewer",
      "source": ".cursor/agents/security-reviewer.md"
    },
    {
      "kind": "rule",
      "id": "git-secrets-safety",
      "source": "registry/rules/git-secrets-safety.mdc"
    }
  ],
  "excludes": [
    "pre-commit/check-secrets.sh",
    "memory-loop.mdc"
  ]
}
