{
  "schemaVersion": 1,
  "id": "engineering-architecture",
  "title": "Engineering and architecture",
  "description": "ADRs, technology tradeoffs, docs honesty, and tech-lead style decisions - stack-agnostic.",
  "version": "0.2.0",
  "members": [
    {
      "kind": "agent",
      "id": "tech-lead",
      "source": ".cursor/agents/tech-lead.md"
    },
    {
      "kind": "skill",
      "id": "docs-repo",
      "source": "registry/skills/core/docs-repo"
    },
    {
      "kind": "agent",
      "id": "docs-repo",
      "source": ".cursor/agents/docs-repo.md"
    },
    {
      "kind": "template",
      "id": "adr",
      "source": "registry/packs/engineering-architecture/templates/adr.md"
    },
    {
      "kind": "template",
      "id": "task-brief",
      "source": "registry/packs/engineering-architecture/templates/task-brief.md"
    }
  ],
  "excludes": [
    "docs-professional-standard.mdc"
  ]
}
