{
  "schemaVersion": 1,
  "id": "quality",
  "title": "Quality",
  "description": "Testing conventions, QA routines, and review checklists — not language runtimes.",
  "version": "0.1.0",
  "members": [
    {
      "kind": "rule",
      "id": "cursor-skills-testing",
      "source": ".cursor/rules/cursor-skills-testing.mdc"
    },
    {
      "kind": "agent",
      "id": "test-suites",
      "source": ".cursor/agents/test-suites.md"
    }
  ],
  "excludes": []
}
