{
  "schemaVersion": 1,
  "id": "clean-code",
  "title": "Clean code",
  "description": "Deslop, simplicity, and surgical refactors for AI-assisted codebases.",
  "version": "0.1.0",
  "members": [
    {
      "kind": "skill",
      "id": "clean-code",
      "source": "registry/skills/core/clean-code"
    },
    {
      "kind": "agent",
      "id": "cleancode-refactor",
      "source": ".cursor/agents/cleancode-refactor.md"
    }
  ],
  "excludes": [
    "code-deslop"
  ]
}
